{"schema":"geometry.step_topology.checkpoint_edit_journal.result.a0","state":{"session":{"session_handle":"gts_1111111111111111111111111111111111111111111111111111111111111111","generation":8},"edit_journal_revision":1,"accounted_string_bytes":128,"estimated_resident_bytes":4096},"source_sha256":"aaaaaaaaaaaaaaaaaaaaaaaaaaaaaaaaaaaaaaaaaaaaaaaaaaaaaaaaaaaaaaaa","source_brep_sha256":"bbbbbbbbbbbbbbbbbbbbbbbbbbbbbbbbbbbbbbbbbbbbbbbbbbbbbbbbbbbbbbbb","target_inventory_sha256":"cccccccccccccccccccccccccccccccccccccccccccccccccccccccccccccccc","occt_version":"8.0.1","transaction_count":1,"journal":{"name":"edit_journal","media_type":"application/vnd.wavenumber.geometer.step-topology-edit-journal","format":"geometer.step_topology_edit_journal.a0","bytes":14,"sha256":"7fa646430db55036b9b854b32c2f8d6f37fd929bf6c74fa31b55d33605719cb4"},"diagnostics":[]}
